{
  "$schema": "http://json-schema.org/draft-07/schema#",
  "$id": "https://example.com/sed/quest.schema.json",
  "title": "Smart Event Director Quest",
  "type": "object",
  "required": ["schema", "questId", "title"],
  "properties": {
    "schema": {
      "type": "string",
      "enum": ["SED_QUEST_1"]
    },
    "questId": {
      "type": "string",
      "minLength": 1
    },
    "title": {
      "type": "string",
      "minLength": 1
    },
    "description": {
      "type": "string"
    },
    "objectives": {
      "type": "array",
      "items": {
        "type": "object",
        "required": ["id", "text"],
        "properties": {
          "id": {
            "type": "string"
          },
          "text": {
            "type": "string"
          }
        },
        "additionalProperties": false
      }
    },
    "rewards": {
      "type": "object",
      "properties": {
        "gold": {
          "type": "number"
        },
        "exp": {
          "type": "number"
        },
        "items": {
          "type": "array",
          "items": {
            "type": "object",
            "properties": {
              "id": {
                "type": "number"
              },
              "count": {
                "type": "number"
              }
            }
          }
        },
        "weapons": {
          "type": "array",
          "items": {
            "type": "object",
            "properties": {
              "id": {
                "type": "number"
              },
              "count": {
                "type": "number"
              }
            }
          }
        },
        "armors": {
          "type": "array",
          "items": {
            "type": "object",
            "properties": {
              "id": {
                "type": "number"
              },
              "count": {
                "type": "number"
              }
            }
          }
        }
      },
      "additionalProperties": false
    }
  }
}
